{
  "date": "20260505",
  "collector": {
    "status": "success",
    "started_at": "2026-05-05T03:25:34.745757+00:00",
    "completed_at": "2026-05-05T03:25:34.745757+00:00",
    "items_processed": 5
  },
  "analyzer": {
    "status": "success",
    "started_at": "2026-05-05T03:27:03.091533+00:00",
    "completed_at": "2026-05-05T03:27:03.091533+00:00",
    "items_processed": 5
  },
  "organizer": {
    "status": "success",
    "started_at": "2026-05-05T03:28:12.723639+00:00",
    "completed_at": "2026-05-05T03:28:12.723639+00:00",
    "items_processed": 5
  }
}